"Invite the people to boycott the upcoming box office movies that will be released soon . Don't forget that the movie industry is also their biggest contributor , what's more , the movie Wonder Woman clearly shows the perpetrators of the Jewish race . Try to see the movie in the Mat Kilau country box office in our country alone , how much has it collected . "
"JUST LAST YEAR THE MOVIE MAT KILAU OI CAME OUT! LIKE OR HATE THAT MOVIE IT'S A MOVIE LITERALLY ABOUT OUR ANCESTORS FIGHTING BRITISH COLONIZERS , APA BEBAL NAK NEUTRAL2 WHEN A LITERAL GENOCIDE IS HAPPENING! THOSE WHO SUPPORT THE COLONIST AGAIN CAN REMOVE IT! PTUI!"
Watched Mat Kilau for Friday night movie and then waved the flag on Sunday for the Prince . Some aunt
"Me explaining to my colleague how Hamas is a fighter for independence blablabla Her: oh you mean , like Daud Kilau? Me: . . . Photocopier: . . . Claim form: . . . Me: Mat Kilaute? It's like that movie , you"
"It's true that Mat Kilau is a fighter . He fought against the oppression of his era . He's not a gangster who collects taxes . Gangsters who number 1 run away from war . lg 1 , fuck movie mat"
"When I knew my son was a boy , I got so inspired by your bravery . That time is already peak with Mat Kilau movie . Like I really wanted and I prayed my son to have this kind of bravery and his adherence to Islam is strong in his veins . Hence his name now"
He remembers him like Mat Kilau the movie who hates English
"I remember the time of the phenomenon of the movie Mat Kilau , when more and more people were proud to be Malay , wearing traditional clothes , at that time there were many crazy people who didn't like it , understand where it came from . These things will make Malay extremists like the Taliban . It is not impossible that the Malays themselves will come to stamp"
Indian Mat Kilau
sorry I never watched the movie until the end . He said
"eh , I don't misunderstand , I don't know that sentence because I've never seen the movie mat kilau"
"Because 4 of them , Israel will kill people slowly because they want to do ethnic cleansing . Fight instead of waiting to die . Nk tgu level army sma mmg xnknla . . we watch 'mat kilau' the movie and yet we still question ppl who fought against"
"Finally watched Mat Kilau yesterday No other Malaysian movie could match its theatrical , comedic and historical-inaccuracy value . . . Best line: ""Dazzling dagger , my name is Mat"
"That's why in the movie mat kilau , the British captain once said , we are a weak nation , a divided nation , we are never United . That's why you are weak . What he said is true , I agree , if we all unite , our nation will be strong . Sad that our nation is broken"
"always proud of what our nation can achieve . I support local films . To do better we need to compete productively . In this era , the source of movies is limitless . Ola Bola , Mat Kilau to name a few are all local blockbusters . Give it sometimes for local films to grow . "
"Hamas is a Hero for Palestinians , see the movie ""Mat Kilau"" , how he defends Malay land from British colonialism . Did he a"
"about reading a book to know this history , I once talked to someone who saw the movie Mat Kilau and completely believed what he showed . when I told him to read a book , he said I don't know Malay . I'm too lazy to debate with people who want to go to the toilet"
The same person blames the Malays for the controversy movie Mat Kilau Tu
"I also remember the film that was not the best , it was dark and full of stress"
"Just finished watching Mat Kilau . Although the situation our predecessors in Malay Archipelago had passed through were much more difficult , movies like this need to be massively produced to make us always remember that kafir and Kuffar nations will always be our enemy then and now . "
MALAYSIANS remember when we were all obsessed over Mat Kilau (the movie)? especially the girls when we thought some of the 6 casts were
"I don't even quote Mat Kilau because I know his history is not the same as what I read in the book , so people use the movie as an ideology . Sometimes I ask the gangs who watch this movie if there are certain scenes that don't follow history"
Annoying Voice of Hun Haqiem = Movie Mat
"Really though . Mat Kilau is a far better movie than this , and Mat Kilau was ahistorical ethnonationalist diarrhea . Hot take time! My bet for best Malaysian movie of the last few years is , and don't kill me for this: PASKAL . That was a fucking kinetic"
Mende babi look at Mat Kilau cry good watch upin ipin the movie
"Yes , I opened the movie because I wanted to cry , I was already looking for the sad part . But look at the Mat Kilau and cry hahaha"
remind me there is a parade from the cast of the movie eramalat cuz last year there was a mat
"Wow , have you seen it? Go fast sister! Nooo Mat Kilau was the worst Malay movie ever! Until now , the trauma of going to see that movie is a waste of 20+ sisters . 6 . 5 is okay then 5 . There are so many people with level 2"
Mat Kilau/Polis Evo 3/Paskal (All Are Malaysian Movies But OMG The Best
"But honestly , Mat Kilau is not very strong plot-wise . The movie has strong support because it has a political element"
"There is a Kanang Anak Kankau movie . Even made earlier than Mat Kilau . The Borneo women just make it worse , they say we are racist to them . Very influenced to be like a black American"
"There is a Kanang Anak Kankau movie . Even made earlier than Mat Kilau . The women just make it worse , they say we are racist towards them . Very influenced by the black narrative"
Mat kilau movie singlehandedly helps PN win the PRN . Ytjt Mat Kilau
"If the movie follows the historical facts about Mat Kilau , it will look 10 times more supremacy because he really fought all the way . His life story is sad . He was under-appreciated"
The Mat Kilau is fine . There are many other movies available . He can be blamed for the Mat Kilau of a movie . What is the fate of the people of Malaysia?
Just watched Sultan Agung on Netflix . I must say every single thing in this movie is far beyond better than Mat Kilau . Story telling: 10 Plot: 10 Script: 10 Cinematography: 9 Acting:
"Movie Mat Kilau is also sold , you want to expect"
Where is the enthusiasm to watch the Mat Kilau movie?
I don't think that's the reason . The people are now ready to vote . . nonsensical stories have no essence . What do you want to support? Example of movie mat
"I thought I would never be able to find an even worse film than Mat Kilau: I was wrong . Iceman : The Time Traveler was a total mess and cringefest . How the fuck dud that movie even got released , "
"fak you men mat kilau haters , mat kilau shat on these movies"
"Tbh right now , you gimme one podium and i read out what i have , i sound like im in the mat kilau movie"
Greta Gerwig's movies are deffo not to the taste of Malays in Malaysia . I guess they'd rather stick to their Mat Kilau
Mat Kilau movies like that are also high-grossing . Good quality Evo police can't even get the collection they deserve . 
"If you want to fight the action-packed Mat Kilau , Christopher Nolan will lose . p/s : Mat Kilau (the film) is not a movie , it's a piece of"
Look at the acceptance of our people . Just look at what happened at mat kilau movies
"In my experience doing startup is investors will put money in ventures that they can relate with . So I guess FINAS people are those who like these kinds of movies , not Star Wars , Shutter Island and Mat"
"Aaaaa… me!!! There are good Malay movies , for example PASKAL . EVO POLICE . KURAFAT Mat Kilau . And also the movies of late mamat"
"Ever since I watched the movie mat kilau , I have learned a lot of language"
"Where? We were in MMU Theater competitions together . Perempuan Itu (long time no TV especially Malay drama) is it Isma's? For years I never followed , last Malay stories I watched was Mat Kilau & the aviation movie"
"Become a song composer and film producer . What songs/movies are hits now , I told myself 10 years ago Examples of the movie Mat Kilau and the song go live for kat aina"
My cousins are watching Mat Kilau so I watched it too What is this movie
Indonesia can produce movies like Big 4 and Hitmen but we are still stuck with Polis Evo and Mat Kilau . Indonesia can produce movies like Qodrat but Malaysia is still stuck with Munafik . 
Uncle . I just finished watching Extraction 2 . Sol Mat Kilau shot the movie
I haven't watched a movie in a long time
Hahaha I can't even see it . Not to mention the movie movie will
"His camera work is not like the style I did in the Mat Kilau film , and it is not like the Kingsman style of camera work . I don't remember what movie , but it's not like a typical mission impossible movie or a common action movie camera work , it's"
Short snippets of Mat Kilau movie will now be used to advance identity politics of race and religion as many have started emerging on social media! Using the snippets out of context can and may inflame people! 6 state elections are coming! Contest based on ideas /
Top 10 highest grossers in Malaysia: 1 . Mat Kilau (2022) - RM89 . 42 million 2 . Polis Evo 3 (2023) - 40 . 24 million (as of June 13) 3 . Hypocrite 2 (2018) - 37 . 74 million 4 . Hantu Kak Limah (2018) - 36 . 40 million 5 . Mechamato Movie (2022) - 35 . 88 million
Puteri gunung ledang movie is so nice . It is beautifully written and it is exactly what mat kilau's writer had ever dreamed of but could never come close to
"You have to make a quality movie to lift your spirits History - ""Mat Kilau"" BM - BI - Math - Science"
"hahaha . . . Mat Kilau movie , of all"
and thought it is so hilarious he chose to make reference from a dialogue in the movie Mat Kilau to support his view???
"Just look at the Mat Kilau of the movie , how do you know how to use history as you see fit . Don't look at it comprehensively . The one who makes the movie and the one who watches the movie . The mentality is the same"
"Polis evo 3 is good . It's not powerful , but it's delicious . I don't think it's a waste to watch a local movie like this near the cinema . Light plot . Action sequence is nice , even better than Mat Kilau in terms of sound and camera angle . The armor plot is thick , but if you look at one piece , you don't even complain . "
"have to make sure that the movie that is made is the best , crazy , then hype , then the quotes beat the Mat Kilau , then people can buy things"
"What to do , with the recent voting trends by the first time voters , influences by dumb tiktok videos , not capable of thinking , movies like mat Kilau which portrays non as enemy . . . . This route is taken to get"
Just watched polis evo 3 . Was an okay movie . Predictable plot . 6/10 for me . BOOT!! Everyone else laughed and enjoyed the movie so much . Ready to get applause from people in the movie hall . But this one can get applause better than the Mat Kilau movie
"Mat Kilau is historical , not a stupid political quote . If you want to make a movie to promote yourself , you can't afford it"
"Movie Mat Kilau best . All of us are excited about the anti-colonial side . Ready to fall in love with martial arts . Anwar's movie , no appeal . I'm asking the boys now , did the movie go viral?"
"It's no problem . . you can do it . . you don't want it . . it's not weird for promotion . . as an example , there are also films like this . . if you want to make a movie about Pas characters . . don't bother . . already confirm 1 . 8 billion worldwide views . . "
I compared it with Mat Kilau for no apparent reasons . Just being bitter because the movie sucks
"But even if I have to , this movie needs to exist (just like Mat Kilau) , to make way for better biopics in the future . Or how not"
"Ermm . . it feels like there are many free tickets at mat kilau . . I got free tickets at mat kilau 4 times . . police evo 3 twice . . I haven't been able to get this anwar untold story because it's fun to run out of free ones . . just like any free movie I've ever had I don't know hahahah . . if it's possible , I'll do it like this for another movie"
"I just finished watching it . Aq perati One2 seats that show full on the website n All are full . Also , other people come . Yes , there are free tickets . But there are other movies too (tanda putera , Mat Kilau) . Why are you fussing?"
"So movie bangnon with Mat Kilau , where else? Dialogue , story line , "
"Mat Kilau . The advertisement is too much . I was also affected . When I saw it , I stopped . 1 old plot . Cinema even gives full slots/day instead of 4 slots/day per cinema movie"
"right? The other day , it was said that it can be used against sale Mat Kilau . to make a movie that doesn't use this hill can only be a dream . "
"Make fun of him because he doesn't focus on the story line and then tears up . . The message of the movie is good and important , there is no touch plate . You're just dizzy"
Mat Kilau > Anwar *In terms of the movie
"Anwar & Mat Kilau movie . I've noticed that Malaysians are too much against/glorifying the fact that films like fact/documentaries . Of course there are inaccuracies/fallacies . Do you really believe that Leonardo Dicaprio died on the Titanic?? It's just a movie , bro . Just enjoy it as it is"
"do movie on Mahathir instead , first day can collect 10 million ringgit and consistently getting 5 - 10 million ringgit for 30 weeks . bok can beat Mat"
"Both are not the best . Objectively speaking , this movie opened strong then withered as an unnecessary PSA that made the ending feel abrupt . Mat Kilau was horrifying in terms of blatant propaganda packaged as a warrior"
"Farid Kamil should have called that chubby first before letting him watch the movie , only to get a high rating like Mat"
We need to make more movies like Mat Kilau than movies that involve stupid
"Yeahh in a Malaysian movie ""Mat Kilau"" he was a good one"
I watched a Mat Kilau movie . He was right . Malay is as noble as creed as religion
"Memali The Movie if you style opponents like Mat Kilau , it's best . Who is suitable to hold the character of ayoh chik? Hasnul like in Polis Evo 2 is also ok"
" . . . I X criticize the movie people say 10/10 , he dogged other people . Even though the review itself is 5/5 Mat Kilau . Stupid"
"Example for me , I strongly disagree with reviewers who say Mat Kilau is the best . I don't like the other movies he recommended . So I ignore him . Chris Stuckkman(?) recommends a lot of stories that I like . There are a few that don't match but so far I'm satisfied"
I watched the last movie review
"I don't know , I didn't even look at it again but . . . Mat Kilau gave him 5/5? Wtf If you want to make a historical film , make it like Lieutenant Adnan , Bukit Kepong , Bang Rajan . It's just real , this is a market in a Mat Kilau movie like a village nasi lemak stall"
Mat Kilau the movie sgt
"shut up , you're busy . back up people who are 5/5 Mat Kilau xde taste movie . BOO"
Is there anyone else who reviews this movie? he turned away
"When I first wanted to watch this PMX movie , I remembered Mat Kilau , but then it didn't happen . Hrmm , don't be afraid of wasting money &"
"I didn't see it until the end of his review . He praises has a basis , he criticizes curses has a basis . You are exaggerating . Why only mention Mat Kilau? He praises animated movies . He licks too"
"Even Mat Kilau can get 5/10 . In 4/10 only . Watch twice , fall asleep twice . Never fell asleep watching a movie at the cinema , but Mat Kilau"
Why do you want to compare Mat Kilau with Movie Bang Non? Movie Bang Non There are opponents fighting each other
"Aah , it's the same . We'll see that it's okay , that Mat Kilau . I don't even think about the movie . Look for fun . If it's fun , it's fun . But it's true , after he made sarah cem , it became a waste on the sole"
"Apart from the overrated movie mat kilau , haters even overrated hate the movie"
"To this day , I'm strange , how did Mamat turn the movie review for a high rating on that Mat Kilau . When he reviews , he always emphasizes the aspect of cinematography , but in Mat Kilau , it is badly destroyed . The cackling camera is too bad . Campelaq . That's the one"
I suspect the Mat Kilau movie will have to be quoted again if there is a review
That's the quantity . Great a movie based on quality not quantity . That's the level of taste Malaysians want to make . Do many Malaysians watch the highest rated movie worldwide? That's why it flopped when it entered the Indonesian market . The quality of Indonesian movies is much better
The highest-lowest grossing thread of 47 films in 2022: Mat Kilau - RM 89 . 42 million Mechamato Movie - 35 . 88 million Air Force The Movie - 29 . 38 million Abang Long Fadil 3 - 24 . 27 million Talbis Iblis - 4 . 12 million The Assistant - 2 . 44 million Nasi Lemak 1 . 0 - 2 . 10 million Remp-It 2 - 1 . 90
"Why did I think of Bell? Hahahaha eheh Beto in Mat Kilau . After the movie , he eclipsed everyone1 I think . This Raya , his face is everywhere! + The star moon & the sweet fat song are over"
Just watched Mat Kilau Why did they treat Mat Kilau's fight scenes as the characters were superheroes . . . The movie itself was OKAY but the glaring issues came from the fight scenes and Captain Syers (his writing was honestly pretty comical it was
Better than all malaysian movies better than Mat Kilau camera Mat Kilau
What record is this uki? This movie looks like dark web
"After the Mat Kilau movie , everybody is a"
"first of all , i never agree with people who condescend the legend Mat Kilau himself , ofc he is one of our national heroes . however , it is never a reason for people to justify shamsul bcs the movie just was terrible and deceptive for so many"
"Yeah because whenever I found a guy idolising mat kilau , he's referring to syamsul yusof's"
"Mat Kilau , the first movie in my life . Soo next we wait , Malbat Mission Bakara | Black Hawk Down . If history he follows what America and the West write . Auto"
Shamsul Yusof . want to make a 2-use Mat Kilau film
"because I don't know you very well , not because of race . If Chin View is making a movie with Mat Kilau and Yusof Haslam's son or the devil boy actor , what's the point? lol . like the case of shooting a pregnant wife , because the perpetrators are not female so there is no hype . That's because of him"
"Those who deny that the British committed murder , destroyed houses , killed villagers in Pahang just like in the movie Mat Kilau . . you should see the episode of the Messenger's Footsteps today . . there is an academic here . "
"(Drop permit , Sen . 6010) 1 . Harry Potter 2 . The tomorrow war 3 . Kate 4 . Enola Holmes 5 . All Marvel Movies 6 . Maze Runner 7 . Black Swan 8 . Avatars 9 . Cruella 10 . Mat Kilau 11 . The greatest"
add on malay movie xlaku this year n maybe mat kilau is on the list this year
"That's right , during the Mat Kilau movie , they kind of dropped that movie , he said he was racist"
what if Malaysia were to make a film on Mahsuri history? would it have a great feedback and engagements such as Mat Kilau and other historic
There are many black raya themes this year . Then the pot bay . The influence of the customer's Mat Kilaute film
"Many movies I've seen in the cinema , but the movies are the most wasteful . It's more hype than the story , it's biased , it's more of a war scene"
Wow . Movie Mat Kilau 2 is
Can the camera man register as a camera man for the next movie mat
Imagine the camera work in this movie is better than Mat Kilau tah maybe choreography is also
This is not from a Mat Kilau movie
i saw munafik and mat kilau movies and i feel like they are made are made for boring people it is so . . . local omggg . usually love the direction and theme of these but the execution and script are rubbish
last got a movie leak story mat kilau full movie looks like it looks like
"We have never been interested in his movie genres since the beginning , except for the latest one , it's a bit dull . I was never interested in his previous movie"
People say that Mat Kilau movie is bad because of bad script . But I didn't expect it was actually REALLY BAD The characters don't have realistic conversations . They just throw 'big quotes' on every chance they get . Like a coffee chat to fight who can say the 'wokest'
Time to stop watching syamsul's movie . Even Mat Kilau is like garbage
His movies are rubbish . You idiots are quickly impressed with Mat
"Fortunately , I have never seen that Mat Kilau movie . Will not support people's business"
My colleague got it finally Tht Mat kilau is too heavy for kids . . now playing suitable for kids and let them know our local animation movies r on par with
"Boycott the movie samsol tok . Even though I'm happy with my luck , I don't go to the movies . Sis"
"If there is a time machine , I want to take Mat Kilau to watch the movie Mat Kilau , let him fight in the theater to see how cringe the movie is . "
"Your movie is trash , many netizens admit that , until Roman Akhramovic lost its luster , why did it enter the Indo market , low rating , praised by its own country . whereas Indonesian movies entering Malaysia get high ratings and are well received"
"In terms of history and heritage , there seems to be no promotion while Pahang could have ride on the Mat Kilau movie and sell Kg Pulau Tawar as a tourism object . Sell Ulu Cheka via Pawang Noh a lesser known legend . There is a Pawang Noh Gallery in Ulu Cheka that is not on the tourism"
"There is a truth , there is a mistake in this statement . Personal is personal . But there are issues like beating people who don't want to stay in support . Let's see if his movie sells or not . Even though the drama penyondol has started and the movie isn't the best , the Mat Kilau is also sold"
"Favorite Movies: Turning Red , Mat Kilau , Texas Chainsaw Massacre 2022 , A Werewolf Boy , All Avatar Movies , Kung Fu Hustle , Secret Zoo , Tokyo Revengers Live Action & Lagenda Budak"
Owh you felt agitated when it came to anything about 'sensitivities'? I wonder where are you when non-Muslims felt 'sensitive' about 'Mat Kilau' movie Every race & religion have their unique sensitivities . Even those feminist movements have
"Some kuning likes to make plots , Raja Abdullah for example . The regiment may be a plot just like how Javanese joined Heiho during Jp occupation there , then used the combat skills to fight against imperialists . But watching Mat Kilau movie followed by Lt . Adnan movie is just"
"I looked at tiktok and suddenly came out after the syamsul/aaron mess . Haha , having watched syamsul's movies , I think he's suitable for gangsters . I was madly disappointed that day . His narration is beautiful . But oh God , his cinematography is ruined . I want to see"
Maybe Mat Sakau the movie will win Oscar since Mat Kilau
"And I think this movie is more successful for the atmosphere of the Malay people than the Mat Kilau movie . Historically fact , I don't know if it is correct or not . It's just that his old Malay vibe is still alive"
"I don't think Mat Kilau , another scenario and the movie scenario make me less masculine . Or maybe its just your netflix secretly spreading the degenerate ideologies like lgbtq"
"I doubt she would be as successful as she is now even if she got full support . Malaysia's market power is too low compared to Hong Kong and Hollywood . Just look Mat Kilau , highest grossing but only 97 mil ringgit far cry from the most mediocre direct to cd Disney movies"
"Malaysians don't deserve TSMY , just go and celebrate mat kilau"
"I think EEAAO is also a story that if a fan of the Mat Kilau movie sees , he will not understand and will not"
"please differentiate between soap operas and movies , and what is the difference between malay moves better? the fact is that msians movies are still far below the level of indo , mat kilaua which was boasted in the past is even equivalent to the quality of indo years"
Imaginur is a movie about Alzheimer's . Nothing much . Overhyped same as Matt
Imaginary . One of the movies I couldn't sleep this year . Solid like the second Malay story I didn't sleep after the luster . Maybe Beto Kusyairi's and Diana Danielle's acting will be right . I can't sleep because everything is a problem and unpredictable . 
"Random thought . As much as I don't like Mat Kilau , they kinda dropped the ball by not releasing any OST . People are streaming Hasrat after watching Imaginur and the movie has only 3 million collections . Granted it is a good song and its my new sendu song . I just think its a missed"
hahaha I'm not sure if Malay movies are hard to watch in cinemas . You can count with your fingers haha . . I always wait for Astro to come out . I can't see it on netflix . 
Yes . . . . I think so too he is protecting his money and other assets . . . . his Mat Kilau movie which he directed made RM 100 million in the box office
"It's nice to know that the movie is the best and is there any content? After leaving the movie , you feel like watching it again . make me feel like that . Mat Kilau makes me want to refund my money & time . "
"Movies like this are what we should praise , not like death"
Mat Kilau is one of the most regrettable movies I've ever seen
"Congratulations , you discovered how the movie business works? Do you want a PhD? How do you think Mat Kilau did so well at the box office?"
A movie should be a movie . It's not like a school Independence Day time video play . Talking about Mat Kilau and all the movies that are similar
"The film industry here wants to win an Oscar at the Academy Awards so bad but when you send a mediocre (personally IMO , really badly made) movie like Mat Kilau as a contender , I feel like there is no"
Compare imaginur with Mat Kilau like comparing movie avengers with beautiful
"For every 'Mat Kilau' movie , there is a 'Flying Butter' . . . I say , why"
