"Movie Mat Kilau , if you have vertigo , don't watch it . Keluaq wayang confirmed that the world is upside down . I can even watch part of the fight scene and feel dizzy"
All those who cursed Mat Kilau movie are those who just watched it on Netflix . . not those who watched it at the cinema . . Why eh?? Can anyone give a reasonable explanation
"I now conclude that some Malaysians don't know how to delve into history and literally make fun of everything , what's so funny about Mat Kilau? It's a good historical movie with tons of heartfelt moments and"
"If you cringe , don't worry . Alas . I can't see netflix JEEEE . If it doesn't come out on netflix , I don't know about this Mat Kilau movie . WEAK . Don't criticize let it be in the circle of people bro"
I will try giving a chance to Mat Kilau movie . tomorrow
"Movie is a form of art . And art , as we know , is subjective . So he's so eager to dictate what's best or not best on behalf of others that it's up to his throat . My opinion about Mat Kilau is only one , his camera work makes me dizzy"
"Had to say this since a lot of talking abt mat kilau , i get yall points by saying that movie needs a lot of improvement , but to say people who don't see that IQ is low or saying ""stupid people support umno"" are even more stupid connotation . Ckp other stupid people doesn't make u look brilliant"
"Thank god I'm not alone , I thought I was the only one who thought Mat Kilau was cringe ah . Actors were great , I just felt the movie was over romanticized with them"
mat kilau was good bro i don't really watch malay fighting movies and even malay movies in general and mat kilau was
"People might expect a director to release a small movie from that era , but if you make a movie like that , you'll get bored of that era and it doesn't suit the taste of today's kids . What's wrong with the director making a movie based on what Gen Z wants to see? hmm poor custom"
I don't want to review the movie Mat Kilau
"Mat Kilau is 5 stars in terms of marketing , that's why it costs 100 million . I like Beto's acting in this movie . His eyes are expensive"
"why are many people criticizing the Mat Kilau , for me the movie is ok and there is"
"For me , it's the best gilaa movie air force , I feel like your quote should be comparable to Mat Kilau , you know , because it's cheap"
"Done look at the Mat Kilau 1- honestly , personally I would rate 5/10 for this movie . Kinda overrated but overall okay . 2- idk but this is just from my opinion as a viewer you know . I know I don't have knowledge in movies but I have to agree when people say the camera time action is amazing"
"Okay , since Mat Kilau movie is suddenly viral now , I want to review a little bit about the movie . I give it 6/10 . First of all , I like how the movie is about the historical of Malaya fighting British colonies . The point is there . But ofc la , there is a lot of the meh side of the"
Why do the people who comment on the Mat Kilau movie say that they watched the movie for free like that? Netflix has to pay subs . I'm going to watch netflix
I think Mat Kilau is much better than Thor 4 I don't think it's the same as you You guys are born straight into action
Race Supramacy Mat Kilau
"Tbh , mat kilau was an ok movie . Quite decent but not that impressive . Afterall , we bought the ticket to support local film although I fell asleep at the last 30min of the"
"Mat Kilau is one of the interesting historical movies . Even though the story line has been developed differently from the original story , we have known one of the Malay fighters for a long time"
"I don't understand if it's noisy , this Mat Kilau is over rated . I'm ok with that quote . That's the level of Malay movies . It's ok because I don't see it in a typical movie . Or a funny ghost movie that is obviously stupid . I want to expect like the Korean cite Mat Kilau that is lambert again"
"You all complaining about the movie Mat Kilau are bored because they keep giving ""speech"" etc . , if your race and religion are in danger you won't want to chat over coffee , what's the Mat Kilaur? Just take what people say as a reminder and"
"I'm not good at reviewing movies in the same way that I'm not very good at reviewing food . If I say it's not the best and it's not good , it's a bad category . Today , many people have a Mat Kilau and Mat Kilau look . I'm ready to watch the movie twice hahaha . And I still don't know"
I literally cried so hard watching mat kilau near the movie and yall wanna say that movie is bad bad? Maybe what is shown at the cinema is not the same at netflix because wtf icb
"I started reading about the history of the Titanic because I just watched the movie Titanic . It's the same after people look at Mat Kilau . At that time , many people were interested in looking back at people to do research on Mat Kilau and read it"
"My favorite moment was when Mat Kilau said ""It's Kilau Time"" and kilaued/defeated the British soldiers . Definitely one of the movies of all"
You enjoyed the movie ok . You're not enjoying it then ok too . To each their own . He turned away because he was tired of reading because he hadn't finished the chapter yet
"My 8-year-old stepdaughter has an interest in Mat Kilau . He was really excited when he saw the movie Mat Kilau that day . Until now , he is still crazy about Mat Kilau . From Mat Kilau's story , he found many other histories . I'm tired"
"It's crazy how lively and beautiful this RRR movie is hahaha 3 hours , it's not lame like a dead man"
The anti-Malay thing is endless and turns to Mat kilau's movie review . Do not have
"It's like me in a scene like that Hindustan movie , that is in one of these scenes where Matt puts a dagger on the neck of Captain Syers . . whispers his name and then the music score comes out . "
"A simple review about Mat Kilau film: I just watched it on netflix last night , for the first time , it's a standard local movie , with the most important action sequence style , slow motion must be there , and I have a feeling that this scene looks like a movie scene"
"Yesterday I just saw Mat Kilau . I've been watching people update their ratings . hmmm , personally , there are many shortcomings in this movie , but the story is great for the dialogue part and"
"I watched mat kilau when it first came out with my sister . Legit could not take the movie seriously because I look at adi putra , all I see is Jai from KL gangster . I can't hold in the laughter every time my mind makes the"
Many of them are biiter with movie mat kilau rilek
"That's right , after that you can cite Najib for corruption without joining the struggle , why does everything have to be politicized? People just watch the movie , they don't want to watch trashy political stories , they want political talk , wait for the pru , they want to insult the Mat Kilau movie just to insult the political party"
"The thing is , if it had been a GOOD movie based on Malay historical figures , it would have appealed to non-Malays as well . As if we all didn't learn about Mat Kilau in school? But it was deliberately made in such a way as to alienate"
"Just wondering , will Mat Kilau , the movie , be able to influence the masses in the upcoming GE 15? Is it significant enough to create sentiments among them"
Condemn Mat Kilau like
The one who commented (after watching it on Netflix) seemed to go to see Mat Kilau in the movie theater is a low IQ audience . . Turned to Malay . . It's about the movie that they are willing to insult other people . . This movie has a lot of holes but it's relaxing
"That day the members went to see Mat Kilau at the cinema . So yesterday I sent him a photo of Adam watching the movie . He replied , oh I know this movie . It's Mat something right? I'm tired friends with this dipping mat . He didn't register to vote after I went to Vietnam"
I don't know if I'm not interested in history or if it's the Mat Kilau movie
"i have seen a lot of negative comments towrds Mat Kilau and honestly everyone can have their own opinion right? so imo , there's no harm in liking that movie eventho its fictional but we all know the fact that Mat Kilau is"
People who like low-budget movies would probably like Mat Kilau and believe it's the greatest thing that's ever happened since their standards are so low . Mat Kilau is simply
M
"These few days , many people are less interested in Mat Kilau shown on netflix & comment about the movie . "
There is very little history in Mat Kilau . So don't expect too much . There are many facts that are wrong with the movie . I want to watch when I'm bored
People complain about the Mat Kilau camera shaking is suitable for Malays . . . . I mean you guys are right . But the story aduhhh this is my second movie where I ended up standing up swearing in front of the TV after Bukit
He's the guy playing
"1 . Cringe script 2 . Special Moves mini reunion 3 . Naively narrated 4 . Although the name of the movie is Mat Kilau , from the movie alone , how much did we get to know Mat Kilau? Imo , Beto*s character was more dominant 5 . The sound effect of the fighting scene is extreme , losing the guitar"
"mention this Mat Kilau . . . . he's a great actor I know who's playing but when you watch this movie , from the beginning haha~ line up"
"Hahah , I said this Mat Kilau was inspired by the movie wong feihung because the sound effect is like Chinese martial art"
"Matt movie is not the best , save money , I don't watch the movie with the action scene , the camera man is shaking , the shooting is martial arts too"
"Not going to even bother watching Mat Kilau . The decline of the Malaysian movie industry is as clear as day . We have stopped learning , stopped innovating , stopped trying . We have the best neighbors (eg . Indo , Thailand) to learn from , but no , we reward"
The raid is an Indonesian film . . the director of captain america only admitted that his fighting scene was inspired by the raid . . even samuel l jackson said that the raid was his all time favorite movie . . this is a Mat Kilau finish you set with the raid
"Special Moves series PASCAL Police Evo Mat Kilau Everyone has their own class Maybe we don't know how many children of Watan whose exposure to police/soldiers/heroes came from this movie For me , this is more important than debating the cinematography issue"
You look at the movie and it doesn't Mat Kilau
Forget about other people's art . . the way I give my opinion can be accepted with the highest Mat Kilau film sales in Malaysia so far
"Can y'all please STFU about reviewing Mat Kilau? If you like it , great . If you don't , it's alright . Everyone has their own taste when watching movies or TV shows . But if y'all make shit up just to fight over a MOVIE , go fuck yourself and touch some grass"
"Actually , I want to rate the Mat Kilau low because I can yawn throughout the story . It rarely happens . But because people buy movie tickets , so I end up rate is high , saying it's good but not the best"
"I don't know why watching a movie can tell people's IQ . If you think Mat Kilau is not the best , just say it's not the best , it's not your taste . But if you want to judge the IQ of the person who watched it based on 1 movie , he said it was the best"
I love all these reviews about Mat Kilau on FB that movie is just
"Mat Kilau is really bad but ITS devil worshipers are different bro , so sorry we have better"
"Sorry i can't give my review for Mat Kilau yet , because the one that is on Netflix rn is just a 2-hour long epic movie trailer . . I believe the actual movie will be released"
"Look , this movie is supposed to unite the Malays , this is dividing the Malays even more"
A lot of people have arrived
Mat kilau is a normal movie for me . But it's not too bad . The earnings of this film can reach 90 million . But you don't need to be the smartest to criticize . You record a selfie video of yourself pom shaking . I want to criticize
Finally being able to watch Mat Kilau after Netflix broadcast it starting yesterday . In my honest opinion even though got a lot of things to improve it's still a great
"Mat kilau is a movie to watch once , not repeat many times . But this movie is not very bad like the netizens criticize . No need to comment badly to criticize people who don't care about your tweet . You don't know the pom who hates that"
"I hope to be able to see Mat Kilau's character live , what kind of personality he has . his conversational style . what I understand is only philosophy . The script of the movie and the character of Mat Kilau is not"
"When Mat Kilau comes out on neflix , movie critics come out and comment like this , Air Force hasn't yet had a story on neflix , ghisau is turned away by the soldiers who comment later . Guys , to produce a movie requires mental and physical sacrifice from each member"
"Why is Mat Kilau's time in movies mostly rated 8/10 , 9/10 , 100/10 . . But when it's on Netflix , people rate 2/10 , -3/10?? Ready to finish one movie in 3 days . Just plan to see it tomorrow"
Kakakakaka mende lah bekap movie mat
The name of the movie is not diary mat kilau and friends . Don't show that stupidity on social media . Shy
"That means neutral , you're not Malay , and you don't know Mat Kilau . Character development in the story is very low . There is indeed a messy plot , for example Awang , the motive behind the creation of the role of Awang is not clear . Wanted to turn it into a drama in a movie , but it didn't happen . From the beginning to"
"It's ok , I'll look at this Mat Kilau story . What are you so fussy about? But for me it's not a big impact to have a movie"
That's why many uncertified movie reviewers were born after the luster
"I will indeed compare it to Merong Mahawangsa because that movie is the best despite having a movie years ago . the ending is also satisfied , not messy . There is no conclusion to this Mat Kilau . It looks very rushed , like you MUST make a movie below 2"
What's the fuss about the Mat Kilau movie btw? Everything is bad . N the lack of extras in each scene just shows that the movie is bad . Really
"If I'm not mistaken , when Mat Kilau came out of the cinema , everyone like , 'it's good' , 'great movies' and whatever . And then Netflix came out , everyone gave bad reviews? What"
Mat Kilau is one of those movies that you love watching the first time and would absolutely hate watching it the second time
"Have you ever seen the IP story? How is he against 10 people? But those who attack him are not all at once . Just like this Mat Kilau story . It's called a story . If you want to be logical , you just read history . No need to look"
"Just looked at the Mat Kilau . It's like watching Isley's Malay speech . The battle scene is dizzying , the camera moves faster than silat . This is the best taste of the movie"
tl today all discuss issues
Is Mat Kilau really that bad of a movie? (Seriously
I only watched the first 5 minutes of mat kilau to already know what's the rest of the movie gonna be like . And it's not what I expected at all based on the sales it made when it arrived
"If you want to give your opinion , you don't want to quote Malay , you can put a polite comment , comment with manners , it's ready to mention a movie for people with a low IQ , how can you lose your manners just by watching the movie Mat Kilau? Watch out today , everyone is trying hard to be the Zhafvlog"
"Mf be like Mat Kilau is a 3/10 and compare it to IP Man when the Malaysian movie track record is Evolusi KL Drift , Impak Maksima and Bini-Biniku"
"What's the case with people raging about Mat Kilau? Relax . Like is subjective . Some like it some don't . It's okay to back up too much or curse too much . To me , can be 1 of my favorite patriotic movies besides Bukit Kepong & Lieutenant"
"None , we watch Mat Kilau and other action/horror"
"comment a little bit about the Mat Kilau film movie . there is something more like him tering everything , turning away"
"Since Mat Kilau has been on netflix , many people have made reviews . . it's like I collected tens of millions , but reviews like this movie are almost too much . . I'm waiting for Air Force to come on netflix , I want to read a review , is there anyone who agrees with it?"
I think people are expressing their disappointment on mat kilau because we rarely get a biopic movie about national heroes . Last time was lieutenant Adnan? Decades later it just got a Mat Kilau (correct me if im wrong) so they expect something wow in
"Done watching the most viral and hype movie ever this year , Mat Kilau . Although it was super cringe but not bad for an Asian producer . I would rate"
there's no end to the Mat Kilaur of Mat Kilau . Those people are already rich . wait . watch the movie . haha . What are you talking about on Twitter?
1 month ago we have supporters who went absolute total blind die hard support on Mat Kilau as if that was the best Malaysian movie ever . Now we have detractors who criticize the movie frame by frame like it's total
"Mat Kilau is a movie . But netizens who are so sarcastic can't be criticized . There are critics like it should depict 101% of history , which doesn't make sense because the movie is made to appeal to the most segment"
"Uwow just realized there's a lot of prejudices on Mat Kilau movie . From the historical aspects of the movie , I think there is not much to be learned as this is not a biography . But to say the movie is for ""Malays with low IQ"" is too"
"Where are you? I don't like all movies . But before this Mat Kilau movie started , someone wrote to tell me that this movie is just fiction . Not round and round follow . Some have also been changed . That's what he meant . You're not focused , you want to talk to me . That's a lot to see"
"Just finished watching Mat Kilau . It's an enjoyable movie . Despite its flaws , weakness and overuse of fast action shots . "
"Already watched Mat Kilau . How to say? I can only give around 1 out of 5 stars . There are so many weaknesses . If you don't want to get ready to relax , fill in the space or give it to the kids , that's it . But not recommended at all for action movies/dramas & history lovers . I like action genre and history"
"Malay klu in the chat section condemned person no . 1 . Hg tgk movie not documentary . He has already made a disclaimer . He has a movie he likes . It's not based on the true story of the last two blackhawkdowns , the west didn't win apo . Suh barat has a hero to make a new Mat Kilau comparable to your taste"
"what you should be angry about is how shitty the movie was made based on the legendary mat kilau . flawed dialogue , cinematography kl"
Defo not . i don't watch movies much and Mat Kilau is really fine
"For me , the luster is normal and I don't have a problem with you being the best because other people have different tastes . But I don't understand that the movie has been in theaters for a long time , ready to collect 100 , 000 , and now people want to criticize it . When it's airing , there's no fuss like this"
not surprised to see mat kilau getting low ratings from people . i've said it before that the pacing was so off and the dialogue sounds pretentious in every way . you can make a patriotic/historical movie without it being as messy as it is
"Thank you for your review . But you know how the effort to make the old historical to become a movie? That is not easy to satisfy everyone , but for me Mat Kilau is the best Malay movie that we can watch to remember the services of our heroes"
"Akhi , we want to be alerted , follow Al-Kuliyyah TV3 . It's more appropriate in a knowledge ceremony like that from the movie Mat Kilau This is my advice for you , brother . Don't have a few verses of the Quran in the movie , I was shocked . That's called lack of soul filling"
"Actually , if you want to criticize Mat Kilau or like Mat Kilau , it's okay . What movie is wrong?"
"What am I talking about? Do you watch movies like this , do you have an artistic soul? Since when can a movie with an artistic soul make money? If there aren't many rich art people It's either They make it fun or They ride the sentiment . Mat Kilau is the"
"I always tell people who haven't seen Mat Kilau , if you want to see the film version of Perhimpunan Agong UMNO . . . Watch the film . It's a bad movie . The positive from the movie , Beto"
"true! many discussions in terms of expanding knowledge in history this what historical movies should be , endless discussion . Independence does not happen without discussions . mat kilau is more like promoting culture w history but history is more"
"Just watched MAT KILAU in netflix . It was a nice movie to watch and get to learn who you are , where are you coming from , where should you stand and why Mat Kilau wanted to save the land so badly , there is a lyrics stated in Negaraku . 4 . 5 cause the ending . . finished"
"Okay , it's everyone's opinion about the Mat Kilau finish , but if"
Finally watched Mat Kilau on Netflix . Let's just say I'm very glad I watched it and wasn't swayed by the reviews from back home . Not to mention the scandal surrounding the movie that had nothing to do with
"When people bring up the issue of Mat Kilau , they just noticed why this year not many people share the independence video for Malaysia Day . There is only one . I always see two or three shorts"
I rather watch Ratsasan (Tamil movie) for the 6th time than watch Mat Kilau for the 2nd
First 10 mins of Mat Kilau is making me how'd
"Since yesterday Mat Kilau started showing on Netflix , it seems that there are more and more negative reviews lol . yes that movie is such a meh . People were not exaggerating tho about the shaky camera . Character development almost none , and the story ends with the climax , no"
"After months of people talking about the movie Mat Kilau ritu , today I can only watch it after going to Netflix . I rarely go to the movies later for sure"
"I'm the only one who doesn't watch the Mat Kilau drama/movie at the cinema . And even when it's free on Netflix , it still doesn't work"
Matt
"Those who don't like watching Mat Kilau movies are welcome . . It's up to each other . . . But I'm ready to stamp people who like to watch that story as ""low IQ"" that's more than enough . . . . . Lek2 dahlew…"
Mat Kilau is a
Is the Mat Kilau movie good? It's a movie . Has a specific appeal . Triggers some specific feelings . Doesn't really leave a lasting impression . Not the actors nor crew's fault . The producer and director just have a specific mission . Was never meant to be
"I also think mat kilau should make a telemovie or movie close to ASTRO first , seriously overrated . For me brother syamsul should've done a lot better than"
"I admit that mat kilau only has 6-7 over 10 storylines . But the acting and effort to produce such a movie is a power , it can cover up the weaknesses of this story . A lot of people just watch it on netflix for"
"Mat Kilau , good movie if you're watching it for the"
tiber so many dislikes
tiber so many dislike for Mat Kilau
"Personally , I really don't like the movie directed by Yusoff's son because I've seen it once on TV , Munafik . Hahahaha so when this Mat Kilau comes out , I'm skeptical when people say it's crazy . The timeline is full of words , it's not the best when it's on Netflix . Fortunately , I didn't run out of money"
"Don't compare it with foreign movies , local movies too , sergeant hassan , even paskal . There is the same element of patriotic spirit without the cringe dialogue & messy plot . But Mat Kilau is still crazy , just because it's Malaysian . Try to turn off the hype & watch it with a neutral feeling . Still"
"People see Mat Kilau near the cinema because of the hype from people who say it's the best . . . I went to the movies with my sister , I also watched . Wtf , not even worth the hype . Just an average movie with horrible fighting scenes"
"Sooo Mat Kilau is it that bad? I read that some people turn off the TV , change to another movie after 10 , 20"
Who is the famous movie critic in Malaysia who dares to promote that Mat Kilau? Now I really doubt his credibility . What the hell do you think this is a crazy solid story? You have no taste
I just feel like watching a movie
After watching it on netflix . . for me this movie is overrated . . air force movie again
"Thanks Netflix for showing the movie Mat Kilau . . with all the hype goin on , our family excited with this movie when it released . . we watched yesterday the whole family , and after 30 minutes of the movie , my mom literally zzzz . . . . it shows what…… (fill in the"
the sentence . . . will you see elvis next week? until I can't see it like this . . . wait for the movie to appear on hotstar or netflix last2 mat kilau appear on netflix
Translating
Last night I watched Mat Kilau on Netflix hmmm I still don't understand why people talk about that movie
You don't like the idea of a comedian taking her veil off to make a joke? Don't watch the video . You dont like an ethnonationalist Shamsul Yusof movie? Don't watch Mat Kilau . Spare yourself the unnecessary stress that you're putting your body
Also why do I think Fattah Amin's acting in Mat Kilau is better than everyone else especially Mat Kilau himself . One expression is the whole
"Instead of making a Mat Kilau , it's better to make a movie for other characters , such as tok elephant to tok beard to dato maharajalela to . . directors in Malaysia don't be lazy"
"I don't like people on Twitter who ""after 10 minutes open the Mat Kilau near netflix , it closes immediately"" I don't know what is your intention to say that . Then add on , ""it's suitable for Malays"" Haah , you're really distracted watching all the movies . The story is old , people are hyped"
