"Look , I'm not hoping for The Imitation Game level of history-biographical movie , but since the title itself is called Mat Kilau . . we should at least get to see a character arc of Mat Kilau rather than just this righteous figure who is clever bersilat that we're"
movies
Can you not defend Mat's movie?
"Dude can't even tell how criticism works like then we say that mostly people condemn the scripts and how to record videos , it has nothing to do with the budget . No one talks about the budget . If you think Mat kilau can be better , give your suggestion to make the movie even"
Mat Kilau as a movie yes But the real history of the man is not an insult Malay Culture=/Malay
"im malay Maybe more Malay than you or the rest . But I will never watch Mat Kilau because 1 . Just another shitty movie . 2 . Actor Adi Putra is hardcore UMNO ass licker 3 . This is a propaganda film . 4 . With ticket sales 100m , show how fuxxed up malay"
Mat Kilau is the worst
"man it's dangerous to say i don't like things anymore not liking Mat Kilau the movie are prone to get attacked it's a fiction , a movie and this is social media we get to say what we like about the movie or not why are we being sensitive"
"I've already talked about 6 people shooting 1 , bro , even Fast and Furious can jump buildings using a car . If you want to make a movie , there's a point . If you want to use logic , don't look at the Mat Kilau , look at National Geographic , that's all there , bro . "
"Compared to movies in the country , there is still a lot of shortages , Merongmahawangsa , Lieutenant Adnan , Bukit Kepong , he has cinematography , dialogue and storyline that are not brilliant but we as viewers are not bored watching and enjoy the movie"
As history movie lover I'm approved Mat Kilau . Sis
"The local movie , Mat Kilau just went from 'best' in the cinemas to 'teruk' on Netflix . Different categories of audiences with different expectations? Or the movie is average? Haven't watched it yet - will wait for it on"
"Ok done , watch a little Mat Kilau movie near the pc monitor . During the fighting scene . Dizziness . People's cameras don't have a stabilizer on their phones so they shake"
"Just watching Mat Kilau . Very cool movie , it is easy to understand and talk about . Definitely not for starbucks folks , but for teh tarik drinkers this is some topic and maybe a start to you know , way to move forward . We are too comfortable to appreciate it"
"It's good to make a trap in the forest , suddenly the British can come out recklessly like that . I feel angry when I watch Mat Kilau movies"
"people are rowdy not because of that luster , but"
"Mat Kilau is fucking ass . The cast , script , production , sound effects , etc . But at least our Malay friends finally have a local superhero movie for themselves . Not surprised why they're all"
"Calling Mat Kilau a propaganda movie is giving a bit too much credit . Good propaganda movies rely on less lazy writing , if nothing else . Its makers were so lazy they had turbaned Sikh soldiers speaking in Hindi . Like , what?! Even in fiction , this bit is just"
"Aah bro , I pay for netflix and the fastest wifi 120 is really just for Mat Kilau . Hundreds of other movies on netflix don't get a single cent . I don't even use my wifi for other things . . I just go back to the cave bro , that's it"
"Mat Kilau the movie had the big disclaimer that it was a work of fiction at the beginning (on Netflix anyway) , while the ""memorial note"" ensures the viewer is aware this is a historical figure . Conflating nationalism , fact , and fiction is the real movie , starring us , "
"Okay , that's enough . Muting the word Mat Kilau because you fucks are annoying as fuck . Movie is shit , deal with it . There is no heavenly reward for that"
"I don't hate the Mat Kilau movie , I just think"
He clearly said that the movie is fiction and inspired by Mat Kilau . What kind of history is it if from start to finish you fight by talking without looking at the camera
Seeing everyone's Mat Kilau reviews and realizing I couldn't make it past the first 5 minutes . These people who lasted the entire movie are people of great resilience and powerful ability to hate-watch something with such
The stupidest rant award on twitter goes to
"""The film Mat Kilau is not made in the Pahang accent , there are many disputes , but the movies Lion King , Finding Nemo , there are no language disputes"
"""The film Mat Kilau is not made in the Pahang accent , there are many disputes , but the movies Lion King , Finding Nemo , there are no language disputes"
"It's deaf against this Mat Kilau Mat Kilau fans . If you don't like it , don't bother watching it . Don't be a demon inciting other people , don't bother watching . Not everyone is interested in Avengers . And not everyone is interested in Mat Kilau . Do you understand? There are many other movies you can watch"
"Netflix's Mat Kilau issue is like this . Many of our people cannot allow other people to have different personal opinions . I don't like one Msia band , I have to chop it up . I don't like the movie Mat Kilau , no"
"As for Dato Maharajalela's movie , I hope to add more camera shake , which is Mat Kilau"
"It's like Netflix has a Mat Kilau story . If you don't like it , watch another movie . What's your IP?"
Right . . that's what I don't understand anti-Mat Kilaute fans . Ready to mention other movies like It's like anti
What do you do when it feels like nothing else can be watched on Netflix? Not Mat Kilau movie . 
"The script is so cringe , so funny as the talk . I patted my head the most when the part of the British colonists had a lecture about the weakness of the Malays in front of the mat kilau when they were first attacked by the tuyuk , what are the British in the movie?"
Done look at Mat Kilau . His story is not bad . Camera shaking? That's because the scene is suspended indeed . You will find a lot of shaking cameras in any action scene movie . It's in the Avengers too
i think mat kilau was good for a local movie idk why y'all are so pressed abt
"There is no issue with this Mat Kilau . It's even the name of the movie . If all of a sudden Syamsul Yusuf wants to make everyone in there write poetry , the dagger has power , Mat Kilau can fly , there is Ismail Sabri from the future to help Mat Kilau , all that is possible"
"Everyone talked about Mat Kilau , but if someone wants to make a movie , I live and fight to see Henry Golding so"
"why don't the people who judge the Mat Kilau movie really relax , you tell the story of a bored omputih , you don't want to judge 14 days and 14 nights . This story has been going on for a long time , why are you up again? triggered because of many support and"
The luster of a die-hard movie
"I just saw the Mat Kilau before I think the movie is ok . A movie about Malay history , right? History is like that , it can be changed at will . What you want to show is"
Mat Kilau is a flop in my books . I dosed off . PAS-centric . Silat is a beautiful art but unnecessary camera movements my eyes ached . camera movement was the best . Weak storyline . is still the best in terms of periodic-ish local movies like
"I don't like Mat Kilau's story , pro colonialists say If you like Mat Kilau's story , he says that we have a bad taste in movies Enough"
I will not pay monthly just to see Mat Kilau . Must want to watch the drama
Doesn't Mat Kilaur . It still beat mat kilau in the box office . Not sure why you are going with % of watchers when your main claim is that no Punjabi movie beat mat kilau in box office . I gave you evidence and you did the favor to embarrass yourself . Really failed to reply
There's no end to the chatter about the Mat Kilau movie
"There is nothing free . . Even the monthly is still paid . . . . I pay rm 55 to subscribe to netflix . . Like I pay rm 55 for every 1 movie on netflix . . . If I don't see that Mat Kilau once , I pay rm 55 to see Mat Kilau . . If I see 10 times , I will pay rm 5 . 5 . . Phm"
"Haha , with a huge Indian population still cannot beat Mat Kilau . Nobody watches"
"The feeling of watching Mat Kilau at the cinema is different if you compare it to Netflix . At the movie , I feel like it's not bad . When I look back on Netflix , it feels like a movie trash"
"The Mat Kilau is bad . Story line , fight scene , script / dialogue are too corny . Can the 100 million be scammed? It was too hard to watch after 30 minutes into it . Was laughing and cringing throughout the movie . There are lots of great malay movies . This aunt"
Many have negative comments about the movie Mat Kilau . The difference between watching
"Mat Kilau is , without a doubt , a horrible movie . Individuals who enjoy it have a low standard for film quality . That concludes the"
In vain Mat Kilau fought to defend religion & homeland only for the modern generation to lower the flag at half-mast to respect the former colonialists . That's the correct sentence . People want to chat about movies
"Real idiot Sikhs . 30% inflation? Haha . Your grandfather from the movie Mat Kilau taught you ah pundek? Hindi movie u claim to b Punjabi , indeed all Sikhs"
"Mat Kilau is 8/10 for me but I wish they could have removed 90% of the preaching in the movie . You can say sincere because of Allah but don't say things in the line of ""destroy oppressors , protect Malay land for Allah"" etc . I don't see Allah plays deus ex machina in your"
"What's the fuss for days about the Mat Kilau movie? That's it , Malaysians"
"Even watching Netflix is paid , but in Netflix there is not only Mat Kilau , there are many other movies . . if you don't want to watch , you can watch other movies , if it's a legitimate movie , we only pay to watch that story . . so the tweeter said watch I understand the meaning of Netflix free"
"Why did many people hit the Mat Kilau after it was shown on netflix? Was it the greatest movie on earth? Definitely no . But I did enjoy it despite the plot that was so meh . Maybe the experience at the movie theater and TV is different , but at the movie theater , it's in the right mood . "
this mat kilau discourse is so lame like u can like a movie and still admit that it's
"He's like you are a fan of Thor movies . I'm a fan of Mat Kilau stories . When a lot of people curse on Twitter about Thor's story , do you get angry? ""Thor is the worst movie I've even seen . . "" like that . Like what they did to Mat Kilau . And not for a full explanation . I'm more interested in the story line"
Watched Mat Kilau for like 10 mins then went to sleep . I was like this movie to talk
"I'm angry . Because I think the story of Thor Thunder & Love is not the best , I will not curse on Twitter . But , when it's a Malay story . . it doesn't Mat Kilau . You will judge . . it's not fair , right? Judge is the worst movie . But don't even explain"
I think Mat Kilau will throw up watching the movie
"people don't make a lot of noise about cite Mat Kilau . I'm not weird . Like seriously , is there a Malay movie that I don't think is the best? nothing like that"
"It's enough if you want to make all logical movies . Even the name is fiction . If the soldier shoots at one time , the movie is only 15 minutes long . It became a short film . Fighting scene over so much? Part of it sounds , but imagine kicking without sound , it looks like action"
"Many local movies are the best . But Mat Kilau is not the best . Also , created by Malay supremacists . After that , I'm smart enough to think for myself , I don't want to be told"
"Those who curse this Mat Kilau film really hate the way of tweeting . It's like just watching the worst movie in my life . Maybe cursing people are trending , so many people join the party to get likes and retweets"
"The problem is correct . If it's a hollywood story , release the same scene as in the Mat Kilau . This tribe does not want to condemn . When it's a Malay movie , you quickly tweet all the things you don't like , and you're happy to say that Malays can't be touched , so you're weak because you want to insult Malays . "
"ah you , if Mat Kilau dies early , it won't be a Mat Kilau movie , you're so stupid , you want to follow your logic"
Fighting scenes in Mat Kilau movie was a
"Why are so many people suddenly arguing over Mat Kilau? I still think it was a fantastic movie , I don't care what other people say . When a movie manages to make you feel strongly emotional about something , for me it is a definite success , despite its probable"
Really bitter twitter boy with Mat Kilau . There is no psal in the movie but he is bitter with his own people ahhaha . Pity . Born Malay can change to another race
"why are peoples in twitter are so pressed about Mat Kilau movie? the cinematic was great , the sound and so on , what do you guys want? chat about dialogue , what do you want to get into? just enjoy the movie , don't like to be silent . you guys tweeting shits here again bringing down the industry"
"Mat Kilau is great for debates even on the storyboard , there are people chatting who say what movie is there sb . Well , sadly , not all of them are in Msia , bro . Haha but a good director always has their own notes on his script . If it's like kabir , he makes a ready shot list for every scene in the script"
"Repeat after me . . ""MAT KILAU IS NOT A HISTORY MOVIE . "
"Seriously arguing about the Mat Kilau movie at TL . To be honest , I gave less than 5 stars . From start to finish , I can't find any factors"
"Am I the only one who doesn't watch this Mat Kilau? Hahahaha Alhamdulillah , you guys have already watched it and are ready to give feedback like you guys , you have time to watch the movie . My Netflix is also dusty , because no one wants to rummage through what movies it's best because there isn't any"
What a waste of your life if the movie doesn't Mat Kilau and you want to debate . 
There are a lot of famous Twitter clans tweeting about Mat Kilau . Even the liberal Malays on Twitter conspired to condemn the movie
"Who is interested in watching Mat Kilau movie , don't force people who are not interested to be interested . Those who are not interested in watching Mat Kilau , don't force interested people not to be interested . That's just a story for me . Designed and created for film . Some like it , some don't like it . "
It's crazy that Mat Kilau movies can be a debate here and there (can't find the popcorn emoji . Corn too
"for me . . it's the best thing . . I didn't see it at the movie , I still feel it . . then twice I saw it on netflix . . for me , its ok . . where is the perfect movie . we as humans are not perfect , this is a movie . Historical movies are boring . over ja malaysian netizens"
"Our views will always be different . The important thing is to ""keep going"" to produce a movie that benefits the community . Good job team Matt"
"At first , I didn't see the Mat Kilau at GSC , it's strange why the language is not right , but when you think about the logic of the spa language , you still want to use it for movies , you want to use b . baku , it's illegal for people to understand , right? I want to read the subs , I want to feel the scenes again . . I just got it . . Last , if you want to make a whole movie , use that language"
"Now you won't believe how much American Political Agenda was shot in that movie but the story is pretty much shit through and through . The reason for its success is simple , Giant Transforming Robots Fight Each Other . Same goes with Matt"
I wonder what you want to fight so much about
"Hats off to netizens who only watch Mat Kilau on Netflix and criticize the movie . In netflix , there was a lot of trash movies before this , but I didn't raise high reviews , even though I watched many of them with similar storylines"
"(In my opinion) Mat Kilau is ok if you want to see it , but it's not as good as it is hyped . There are still many flaws . But anyway , this movie is still successful in terms of"
"Pd I , not only experts are eligible to comment . Maybe yes , he is not a film maker , but he always watches other people's movies and works to have enough benchmarks vs the hype . Eg , I am a copywriter by profession . But as I watch manyyyyy movies , I think Mat Kilau's presentation is still not umph , much"
"After this , if there is a movie like Mat Kilau , I will wait for netflix"
Why? Because paskal looks too personal . Mat Kilau may be too flashy and not to my preference . The Air Force brings goosebumps . It seems that the struggle to escape from terrorists and the personal character element does not overshadow the patriotism element of the
Gosh!! I can't stand it . . . I feel nauseous and continue to breastfeed my child while watching a movie
"What's wrong with mat kilau . . haiyaaaaa . . do you want a movie level like hollywood to mat? Haaa , I'm going to make a movie , will you see . . until it gets 10k collections? Erghhh . . so many songsehh"
10 mins
"You're just a member of Netflix , you don't pay us , we pay for two months and free info for you bro , Netflix buys the movie Mat Kilau so its not FREE"
For me cite Mat Kilau is not perfect but to label this movie as bad is like not agreeing a little . . Who says this is bad I can say that people have very high expectations . . With collections up to 97 million so people remember cite Mat Kilau very much perfect &
"The Mat Kilau is decent . Best action , just love the camera , God . His dialogue is not very good but still shocked to see a Malay movie like this . 3/5 After this another hero"
What about malay movie . . The title is MAT
Most overrated movie . Mat Kilau . 
May those who support and criticize Mat Kilau movies continue to contribute to the development of Malaysian films and raise the spirit of patriotism throughout
Article Mat Kilau is also an issue? What are you arguing about the movie?
Mat kilau movie is Malay version of IP MAN . There I've said
"Yes , he should have asked people why he was so bitter that he even defended the film . even though he's the one who's bitter when he criticizes the Mat Kilau movie that was released a long time ago"
"most malaysians rn: you're sick of criticizing Mat Kilau movies! * okay , have fun watching shit movie quality in the next 10 years . while other countries already have a 'recipe' for certain types of movies . It's not , the story of history is like watching a special movement"
Great actor with great skills . Just often time with bad scripts and bad directors . Like I said . Bad movies = Mat Kilau is one of them . Bad performance = None in my
There are two groups that appear after looking at Mat Kilau . 1 . Turning Art 2 . Terpa Malay Just enjoy the movie and don't belittle people who don't like or like watching movies
"Anywaysss it's not bad , it's Mat Kilau and I don't understand why people give bad reviews but yeah it's people's opinions and yes I do think they still have a lot of room for improvements . I'm proud that msians are now taking steps to produce this kind of movie more than the rempit one so"
"We don't condemn Mat Kilau films for nothing , but for the people in the industry to improve their products because we want to make high quality films which our neighbors Thailand and Indonesia have been doing for the past 15-20 years . Please learn , won't you?"
It's a good feeling to watch a Mat Kilau movie with another netflix . That's why a lot of people say it's not the best when watching netflix Mat Kilau movies
"Watching Mat Kilau for the first time in Netflix . Its a bad movie . Cringy . The dialogue was unnatural . 1/10 . Luckily watch it in netflix , so I can say the netflix version is bad . "
"If you are looking for a decent anti-colonialist kung fu movie , 'Mat Kilau' is pretty good . As a westerner I like the movies where the colonialists are not the"
Staying myself away from Mat Kilau review so I can have my own thought about the
I know Mat Kilau is bad and everything but I don't think that movie deserves 2/10 . Its 5 or
i watched mat kilau . and lasted only 30 minutes . then i changed marathon criminal minds . and alhamdulillah i didn't waste money buying tickets when people hyped this movie . cheated
"anyway . It's fun to see people fighting about the movie mat kilau . as a film that has been published , shown . it is what it is . let people want to criticize any comment . You are the one who decided to show the movie , so let people say what they want to say"
It's noisier than this Mat Kilau movie . It sounds the same over and over again . . not appetizing to the
Mat kilau is one of it if you want a bad movie . Bad performance maybe
Mat kilau is a decent movie but the sound effect wow
"The best thing is what's bad , even if it's bad , at least this Mat Kilau can come to teaching , then it's easy for students to understand history instead of reading and memorizing from textbooks . Those who feel bad go make movies"
It's sad to see so many people review this Mat Kilau film . No one is forcing you to watch it
"Every line in the script is like a religious/political talk . His action scene is ok . At this stage , the Msia audience says it's the best? A lot of people say don't compare with Hollywood , Bollywood etc etc but shouldn't we compare with the best so that we can improve? Mat Kilau"
Hikayat Merong Mahawangsa is the standard of Malay hero movies . Mat Kilau is literally a
"I don't know . Mat Kilau stays 9/10 . One of the best movies that has been brilliant for me . With the actors & sentences that were thrown all A+ & hit my soul . Other people want to curse , curse . But Don't ""Insult"""
"Damn , they are fighting about Mat Kilau again . He was fighting about the movie that was playing at the cinema"
"My mom reacted to the Mat Kilau movie: The story is okay , I enjoyed watching it . But the opponent's part , the camera is terrible . For me , I am like my mom . It's also fun to watch"
"It's not about matt kilau criticizing xbest . zhaf . . . don't criticize the movie please , don't insult taste"
"this mat kilau argument , the movie was good if u compared it to any other malaysian movies but nothing rly that astounding or extra-ordinary abt that movie . it was cringe thru n"
"Whatever it is , Mat Kilau is the most commercially successful film in Malaysia to date . Syamsul Yusof played to his strength (he knows he can't art berat movie) and really knows his"
I want to curse the movie Mat Kilau . Don't curse Beto Kusyairy . I fought until the end
I don't want to defend and condemn more fictional movies whose characters are just coincidences with history . Fictional . Rekaan . We should not even care if Mat Kilau is wearing a superman shirt riding a dinosaur against the British while singing a song
Why are people bashing this Mat Kilaute film? Are your expectations high to the seventh heaven? The gist is not much but it's such a good movie to
"The one that turns me off is this Mat Kilau , I see a lot of chatter but there is no content , I just want to check . Apparently the lesson you got from the movie is gonna mute this , have fun swearing in me"
It's also funny the fanatics who can't see people commenting on the Mat Kilau movie like this movie determines Malay sovereignty . Technical critics and pushy scripts . Each POV . Do you want a story that lifts silat and the script is okay but the budget is way lower but a good movie? My take is
I'm glad I didn't watch Mat Kilau on the Cinema . I don't like it . I hope future movies will improve
"Wanted to watch it on netflix , but read on twitter many people regret watching it . I'm sorry I didn't go to the theater . . well I watched the movie 365 days part"
Okay
"okay , just finished looking at the Mat Kilau . the movie was good 7/10 . if I'm syamsul yusof's sister , it's best to be able to comment on where to touch up for the audience to get what they want when watching a movie"
muted 'mat kilau' forever because I checked tweets fighting about the movie . what's stupid??? not
Wehh what people hype is so dull ehh i just watched it and I don't understand what makes people hype it that much . It's a great movie tho but gosh the acting is
Might rewatch Mat Kilau since a lot of people came to see what I've missed during my first viewing near the stage . Before the rewatch I gave the movie a hensem/10 which can translate to a high
"I wonder how many days people on twitter want to fight about this Mat Kilau movie? That day , when I went out on stage , there was already a row . . this continued the row . not"
"When I first watched the movie , I was hoping it was Mat Kilau . Man gave a fantastic performance alongside Adi"
"Why is there so much hate on Mat Kilau? Chill bro , it's not normal to watch brain shutdown movies at any moment , Rokiah brother"
"Tgk Comment , it's true that the film has a Mat Kilau finish , but the Malay people are divided . This movie is also a rowdy alliance . "
"What do you expect this Malaysian film to be wow wow? People are amazed by Mat Kilau movies because Malaysia doesn't always have movies like that . But if you expect that there is no error , it is a big mistake"
"Match the emotional hang name lol . That day , Zhaf cursed the yellow girl , you said it was her right as a ticket-paying audience to comment on the movie , what's the point of criticizing it , she insulted me even more . I'm criticizing and getting criticized by Mat Kilau fans . Hypocrite"
"It's fun to curse the movie Mat Kilau . I'm quite happy that someone is willing to make a movie about a historical figure , not an influencer , a drug kingpin who speaks Malay plates , a rich family who wants to pay for it , a slapstick comedy that has no direction"
who turned away Malay butthurt crazy people
"As a movie lover , I hope the government does not sponsor historical movies and give exclusive contracts to Syamsul Yusuf . He's good but not good enough . Movie Mat Kilau was a disappointment . The good things about that movie are the actors , props , n choreography (excluding camera"
